{
  "Identifier": "RR-NL-0003",
  "Type": "Invalidation",
  "Country": "NL",
  "Version": "1.0.0",
  "SchemaVersion": "1.0.0",
  "Engine": "CERTLOGIC",
  "EngineVersion": "0.7.5",
  "CertificateType": "Recovery",
  "Description": [
    {
      "lang": "en",
      "desc": "The validity start date must be before the validity end date."
    }
  ],
  "ValidFrom": "2021-06-01T00:00:00Z",
  "ValidTo": "2030-06-01T00:00:00Z",
  "AffectedFields": [
    "r.0",
    "r.0.df",
    "r.0.du"
  ],
  "Logic": {
    "if": [
      {
        "var": "payload.r.0"
      },
      {
        "before": [
          {
            "plusTime": [
              {
                "var": "payload.r.0.df"
              },
              0,
              "day"
            ]
          },
          {
            "plusTime": [
              {
                "var": "payload.r.0.du"
              },
              0,
              "day"
            ]
          }
        ]
      },
      true
    ]
  }
}
