{"AffectedFields":["r.0","r.0.tg","t.0","t.0.tg","v.0","v.0.tg"],"CertificateType":"General","Country":"CH","Description":[{"desc":"The targeted disease agent must be COVID-19 of the value set list.","lang":"en"}],"Engine":"CertLogic","EngineVersion":"0.7.5","Identifier":"GR-CH-0001","Logic":{"and":[{"if":[{"var":"payload.r.0"},{"in":[{"var":"payload.r.0.tg"},["840539006"]]},true]},{"if":[{"var":"payload.t.0"},{"in":[{"var":"payload.t.0.tg"},["840539006"]]},true]},{"if":[{"var":"payload.v.0"},{"in":[{"var":"payload.v.0.tg"},["840539006"]]},true]}]},"SchemaVersion":"1.0.0","Type":"Acceptance","ValidFrom":"2021-09-22T12:00:00Z","ValidTo":"2031-01-01T00:00:00Z","Version":"1.0.1"}
