{
  "Identifier": "RR-NL-0000",
  "Type": "Acceptance",
  "Country": "NL",
  "Version": "1.0.0",
  "SchemaVersion": "1.0.0",
  "Engine": "CERTLOGIC",
  "EngineVersion": "0.7.5",
  "CertificateType": "Recovery",
  "Description": [
    {
      "lang": "en",
      "desc": "At most one r-event."
    }
  ],
  "ValidFrom": "2021-06-01T00:00:00Z",
  "ValidTo": "2030-06-01T00:00:00Z",
  "AffectedFields": [
    "r.1"
  ],
  "Logic": {
    "!": [
      {
        "var": "payload.r.1"
      }
    ]
  }
}
