{
  "Identifier": "RR-DE-0001",
  "Type": "Acceptance",
  "Country": "DE",
  "Version": "1.0.0",
  "SchemaVersion": "1.0.0",
  "Engine": "CERTLOGIC",
  "EngineVersion": "0.7.5",
  "CertificateType": "Recovery",
  "Description": [
    {
      "lang": "en",
      "desc": "The positive NAA test result (e.g., PCR) must be older than 28 days."
    },
    {
      "lang": "de",
      "desc": "Der positive NAA-Test (z.B. PCR) muss mindestens 28 Tage zurückliegen."
    },
    {
      "lang": "fr",
      "desc": "Le test TAN positif (p. ex. PCR) doit dater d‘au moins 28 jours."
    },
    {
      "lang": "es",
      "desc": "Deben haber transcurrido como mínimo 28 días desde que una prueba de amplificación de ácidos nucleicos (por ejemplo, una PCR) diese positivo."
    },
    {
      "lang": "it",
      "desc": "Il NAAT positivo (ad es. test PRC) deve risalire minimo a 28 giorni fa."
    }
  ],
  "ValidFrom": "2021-07-03T00:00:00Z",
  "ValidTo": "2030-06-01T00:00:00Z",
  "AffectedFields": [
    "r.0",
    "r.0.fr"
  ],
  "Logic": {
    "if": [
      {
        "var": "payload.r.0"
      },
      {
        "not-before": [
          {
            "plusTime": [
              {
                "var": "external.validationClock"
              },
              0,
              "day"
            ]
          },
          {
            "plusTime": [
              {
                "var": "payload.r.0.fr"
              },
              28,
              "day"
            ]
          }
        ]
      },
      true
    ]
  }
}